{"data":{"content":{"depart":"09:30"},"fold_ref":"f80b9b513fc928d11e8aceb66a29d7cfb7540a0bb8451c9017630b105602e9f5","temporal":{"t_admit":"2026-08-27T08:00:02Z","t_event":"2026-08-27T08:00:00Z","t_observe":"2026-08-27T08:00:01Z","t_present":"2026-08-27T11:00:00Z"},"truth":{"provenance":"observed_signed","ref":"ver-1","truth_class":"fact"}},"datacontenttype":"application/json","id":"477e868489f5c48d138e4c084e9bf13a40ed66390b964365869f7578dfa2e75a","source":"urn:a3:source:train","specversion":"1.0","subject":"trip.milano","time":"2026-08-27T11:00:00Z","type":"a3.belief.admitted"}