{"data":{"attestation":{"attester_id":"urn:a3:party:attester","requester_id":"urn:a3:party:requester"},"content":{"depart":"09:30"},"fold_ref":"f80b9b513fc928d11e8aceb66a29d7cfb7540a0bb8451c9017630b105602e9f5","temporal":{"t_admit":"2026-08-27T08:00:02Z","t_event":"2026-08-27T08:00:00Z","t_observe":"2026-08-27T08:00:01Z","t_present":"2026-08-27T11:00:00Z"},"truth":{"provenance":"observed_signed","ref":"ver-1","truth_class":"fact"}},"datacontenttype":"application/json","id":"1fec213fbaf6d420cf9ff95c51c022c4cdfb1f43fabcf82647e03c03f92f2b7b","source":"urn:a3:source:train","specversion":"1.0","subject":"trip.milano","time":"2026-08-27T11:00:00Z","type":"io.a3ep.belief.admitted"}