{"data":{"content":{"exit_code":0,"postcondition_verified":false,"printed":"SUCCESS"},"temporal":{"t_admit":"2026-08-27T11:00:00Z","t_event":"2026-08-27T10:59:50Z","t_observe":"2026-08-27T10:59:55Z","t_present":"2026-08-27T11:00:00Z"},"truth":{"provenance":"observed_signed","truth_class":"observation"}},"datacontenttype":"application/json","id":"6c8304b366353dfc0ac1bd7dea5f064ad6209bb22bb14ff5c138f80233d24baa","source":"urn:a3:source:gemini","specversion":"1.0","subject":"process.receipt","time":"2026-08-27T11:00:00Z","type":"a3.observation.admitted"}